[
  {
    "loop_run_id": "loop_gate6_validate_project_name",
    "project_id": "gate6-target-validate-project-name",
    "user_goal": "在隔离测试 repo 中修复 validateProjectName(name)，要求空字符串、纯空格、超过 80 字符失败，合法名称通过。自主完成 PRD、任务拆解、开发、评估、打回、修复、最终验收。",
    "normalized_goal": "Repair validateProjectName(name) so empty strings, whitespace-only strings, and names longer than 80 characters fail, while valid project names pass; execute the Codex Loop native multi-agent flow with PRD, TaskGraph, baseline evaluation, repair, final evaluation, and validation evidence.",
    "status": "GOAL_RECEIVED",
    "current_module_id": "Gate6",
    "current_iteration": 0,
    "max_iterations": 4,
    "source_of_truth_files": [
      "README.md",
      "package.json",
      "src/project-name.js",
      "test/project-name.test.js",
      "docs/PRD.md",
      "docs/ACCEPTANCE_CRITERIA.md",
      "docs/TASK_GRAPH.json"
    ],
    "started_at": "2026-06-19T00:00:00.000Z",
    "updated_at": "2026-06-19T00:00:00.000Z",
    "completed_at": null,
    "stop_conditions": [
      "npm test passes",
      "Initial evaluator records NEEDS_REVISION before repair",
      "Final evaluator records PASS after repair",
      "Native subagent lifecycle evidence exists"
    ],
    "budget": {
      "max_repair_iterations_per_task": 2,
      "max_context_restarts_per_agent": 1
    },
    "metadata": {
      "gate": "Gate6",
      "parent_thread_id": "parent_native_loop_current_thread",
      "native_subagent_mode": true
    }
  },
  {
    "loop_run_id": "repair-loop-001",
    "project_id": "m12-repair-loop-001-target",
    "user_goal": "Fix the validator and run tests. If a review finds issues, repair them.",
    "normalized_goal": "Validate project names by rejecting empty, whitespace-only, and overlong names; record an initial evaluator finding for missing whitespace-only handling; create a RepairRequest referencing that finding; repair the validator; produce a final PASS evaluation; run npm test before finishing.",
    "status": "READY_FOR_NEXT_MODULE",
    "current_module_id": "M1",
    "current_iteration": 1,
    "max_iterations": 2,
    "source_of_truth_files": [
      "package.json",
      "src/project-name.js",
      "test/project-name.test.js",
      "artifacts/eval-report-needs-revision.json",
      "artifacts/repair-request.json",
      "artifacts/dev-result.json",
      "artifacts/eval-report-pass.json"
    ],
    "started_at": "2026-06-21T00:00:00.000Z",
    "updated_at": "2026-06-21T00:00:00.000Z",
    "completed_at": null,
    "stop_conditions": [
      "final evaluator PASS",
      "npm test passes"
    ],
    "budget": {
      "max_repair_iterations_per_task": 2,
      "max_context_restarts_per_agent": 0
    },
    "metadata": {
      "workspace": "target-repo",
      "mcp_cross_agent_state_verified": false,
      "native_subagents_not_used": "multi_agent_v1 requires explicit user request for subagents"
    }
  }
]
